Doctor ID,Doctor Name,Doctor Score,Scoliosis Type
5641,Dr GRANT GARLICK Temple Terrace FL ,5.0,dextroscoliosislevoscoliosisneuromuscular
5644,Dr Jocelyn L. Bush Indianapolis IN ,3.25,levoscoliosis
5645,Dr Sheldon Salaba Hamilton ON ,4.75,kyphosis
5647,dr lindsey szymaszek willow grove pa us,5.0,infantile
5648,dr waheed rehman ville saint laurent qc ca,4.0,juvenile
5650,Dr Kathleen Williams Ormond Beach FL ,2.25,adolescent
5651,Dr ERIC M. HILL North Richland Hills TX ,5.0,adult
5652,Dr Peyman Saadat Beverly Hills CA ,5.0,dextroscoliosisstructuralcompensatory
5653,Dr KATHY MAHALATI Hyattsville MD ,5.0,dextroscoliosisfunctional
5654,dr bryan pang melbourne vic au,5.0,dextroscoliosislevoscoliosisneuromuscular
5655,Dr Jared M. Wasserman Englewood NJ ,5.0,compensatory
5656,Dr Jean Hudson Mississauga ON ,4.0,dextroscoliosis
5657,Dr KENT M. HAMILTON San Antonio TX ,5.0,levoscoliosis
5658,Dr Armita Bijari Hinsdale IL ,4.0,kyphosis
5659,Dr Isabel Feinstein Sun CIty AZ ,2.0,idiopathic
5660,Dr Matthew Cohen Mahhassat NY ,4.5,infantile
5661,Dr David C. Mady Windsor ON ,5.0,juvenile
5662,Dr Paul Varcoe Gold Coast QLD ,4.0,lordosis
5663,Dr FRANK FARBOD MARQUETTE MI ,5.0,adolescent
5664,Dr Allen S. Garai VIENNA VA ,4.75,adult
5665,Dr JOSEPH D. DIROCCO Towson MD ,3.75,dextroscoliosisstructuralcompensatory
5668,Dr NATALIE M. CURCIO Birmingham AL ,5.0,compensatory
5669,Dr Avi Wallerstein Montreal QC ,5.0,dextroscoliosis
5670,dr harina thyriar montreal qc ca,4.5,levoscoliosis
5671,Dr Steven Sayers Edmonton AB ,4.0,kyphosis
5672,Dr Shereen J. Chang Cedar Rapids IA ,5.0,idiopathic
5674,Dr Shannon Davis St. John_apos_s NL ,4.0,juvenile
5675,Dr Paul J Fenyves New York NY ,4.0,lordosis
5676,Dr Martin R. Aidelbaum Surrey BC ,4.0,adolescent
5677,Dr Olivia H. Hutchinson New York NY ,4.0,adult
5678,Dr Gregory S. Weinstein Philadelphia PA ,4.5,dextroscoliosisstructuralcompensatory
5679,Dr Roberta S. Isberg Brookline MA ,5.0,dextroscoliosisfunctional
5680,Dr JEFF S. PIERCE Troy MI ,4.25,dextroscoliosislevoscoliosisneuromuscular
5681,Dr Alison N. Gordon San Diego CA ,5.0,compensatory
5682,Dr Brian Ash Brookline MA ,4.0,dextroscoliosis
5683,Dr Andrew Kay Toronto ON ,5.0,levoscoliosis
5685,Dr David Carey Brisbane QLD ,3.25,idiopathic
5687,Dr Peter FORD Chapel Hill NC ,3.0,juvenile
5688,Dr Brent W. Bellotte BOCA RATON FL ,5.0,lordosis
5692,dr meena hussain milton on ca,4.5,dextroscoliosisfunctional
5693,Dr Amanda Bray Barrie ON ,4.0,dextroscoliosislevoscoliosisneuromuscular
5694,Dr RADMILA SAMARDZIJA Blue Springs MO ,5.0,compensatory
5695,Dr Jessica H. Zaret Virginia Beach VA ,5.0,dextroscoliosis
5696,Dr Barbara Heller Lombard IL ,1.75,levoscoliosis
5697,Dr Paul V. Ledesma CAVE CREEK AZ ,4.75,kyphosis
5698,Dr MARCO A. FIORE URIZAR Miami Beach FL ,4.0,idiopathic
5699,Dr Wally Dhol Calgary AB ,3.0,infantile
5700,dr graybiel toronto on ca,4.5,juvenile
5701,Dr Simin Khoshand Ajax ON ,5.0,lordosis
5702,dr dimitri kazakos london eng uk,5.0,adolescent
5703,us nj edison anita ravi,5.0,adult
5704,Dr Nayeem Esmail Vancouver BC ,5.0,dextroscoliosisstructuralcompensatory
5705,Dr Xuan Vinh Nguyen Montreal QC ,5.0,dextroscoliosisfunctional
5706,Dr Jennifer Winter Robinson Victoria BC ,4.5,dextroscoliosislevoscoliosisneuromuscular
5707,Dr MEHRYAR R. TABAN BEVERLY HILLS CA ,5.0,compensatory
5708,Dr David B. Auerbach MAITLAND FL ,4.5,dextroscoliosis
5709,aaron cosman portland or us,4.25,levoscoliosis
5710,Dr Angelyn Salaberry Kelowna BC ,4.75,kyphosis
5711,Dr INNA MARCUS HENRICO VA ,3.5,idiopathic
5712,Dr AMIR HARANDI Louisville KY ,5.0,infantile
5714,Dr PETER J. SUNENSHINE Tampa FL ,5.0,lordosis
5715,Dr Mazin I. Abdullah COSTA MESA CA ,5.0,adolescent
5716,Dr Angela N. Buffenn Los Angeles CA ,2.25,adult
5718,Dr Jennifer Smith Calgary AB ,5.0,dextroscoliosisfunctional
5719,Dr Maria McCloskey Ottawa ON ,4.25,dextroscoliosislevoscoliosisneuromuscular
5720,Dr Sonya Kashyap Vancouver BC ,4.5,compensatory
5721,Dr Richard Finkelman Lawrence MA ,2.75,dextroscoliosis
5722,Dr Dawn Anderson Montreal QC ,4.0,levoscoliosis
5723,Dr Ari Baratz Toronto ON ,3.25,kyphosis
5725,dr larrabee quincy ma us,4.0,infantile
5726,Dr Dennis Desjardins Calgary AB ,5.0,juvenile
5728,Dr VLADA FRANKENBERGER EAST SETAUKET NY ,4.5,adolescent
5730,Dr LAURA K. SLAUGHTER Allen TX ,5.0,dextroscoliosisstructuralcompensatory
5731,Dr Keith E. Kesler Austin TX ,4.75,dextroscoliosisfunctional
5732,Dr Brian Martin Vancouver BC ,4.25,dextroscoliosislevoscoliosisneuromuscular
5733,Dr Ashok Jain Sugar Land TX ,4.0,compensatory
5734,Dr Shalu Pal Toronto ON ,4.0,dextroscoliosis
5735,Kathy M. Fair Boca Raton FL ,5.0,levoscoliosis
5736,Dr Raj Jegatheeswaran Scarborough ON ,4.5,kyphosis
5739,Dr BIJO KYTHAPARAMPIL JOHN JACKSONVILLE FL ,4.0,juvenile
5740,Dawn Ammirata Wayne NJ ,4.0,lordosis
5742,Dr Adrienne LeVasseur Calgary AB ,5.0,adult
5743,Dr Rabia Meghji Calgary AB ,4.75,dextroscoliosisstructuralcompensatory
5744,Dr Millie A. Behera Scottsdale AZ ,5.0,dextroscoliosisfunctional
5745,Dr David Shusterman Rego Park NY ,3.5,dextroscoliosislevoscoliosisneuromuscular
5746,Dr Kaizad Shroff Columbus GA ,4.0,compensatory
5747,dr eileen lo calgary ab ca,4.0,dextroscoliosis
5748,Dr Christopher L. REEVES WINTER PARK FL ,4.0,levoscoliosis
5749,Dr A. Alex Mohit Tacoma WA ,4.5,kyphosis
5751,Dr Paul R. McCombs Nashville TN ,4.0,infantile
5752,Dr Peter W. Butler Springfield MA ,5.0,juvenile
5754,Dr JOSEPH A. CIAVARELLA Hollywood FL ,5.0,adolescent
5755,Dr EMELIA A. BACHMAN NEWARK DE ,5.0,adult
5756,Dr Josue Maysonet KISSIMMEE FL ,5.0,dextroscoliosisstructuralcompensatory
5757,Dr ANNA A. STANISLAUS Joliet IL ,5.0,dextroscoliosisfunctional
5758,Dr Ellen A. Ronnen New Brunswick NJ ,3.0,dextroscoliosislevoscoliosisneuromuscular
5761,Dr Jeremy A. Schwartz Fort Myers FL ,5.0,levoscoliosis
5762,Dr Mark Lerman Dallas TX ,4.0,kyphosis
5763,Dr Fabrizio Cecaro London ENG ,5.0,idiopathic
5764,Dr MARY B. SNELLINGS Mansfield TX ,5.0,infantile
5765,Dr Jonathan Vecchiarelli Toronto ON ,4.75,juvenile
5766,Dr Hugh McGregor Brisbane QLD ,5.0,lordosis
5767,Dr ADAM C. FETTIG Kirkland WA ,5.0,adolescent
5768,Dr Nanda Kumar Manhattan KS ,3.0,adult
5769,Dr Gerald H. Sokol Hudson FL ,5.0,dextroscoliosisstructuralcompensatory
5773,Dr Susan Reed Toronto ON ,5.0,dextroscoliosis
5774,Dr A. Syed Saskatoon SK ,3.0,levoscoliosis
5776,Dr MEHBOOB NAZARANI Houston TX ,5.0,idiopathic
5777,dr michael wong bel air md us,5.0,infantile
5779,Dr Chethana RAO Fairfax VA ,4.0,lordosis
5780,JOSEPH M. TONZOLA TOMS RIVER NJ ,4.75,adolescent
5781,Dr SHERVONDALONN R. BROWN MURFREESBORO TN ,3.0,adult
5782,dr stephanie power toronto on ca,4.75,dextroscoliosisstructuralcompensatory
5783,Dr Michael A. SAVITT MISHAWAKA IN ,5.0,dextroscoliosisfunctional
5784,dr naheed ali aurora on ca,4.0,dextroscoliosislevoscoliosisneuromuscular
5785,Dr Mark Eckler Mississauga ON ,4.0,compensatory
5786,Dr Matthew S. Anderson Neenah WI ,5.0,dextroscoliosis
5787,dr michael niebergall north bay on ca,5.0,levoscoliosis
5788,Dr Sunny Dhingra Vaughan ON ,5.0,kyphosis
5789,Dr UMESH C. YALAVARTHY Euclid OH ,4.5,idiopathic
5790,Dr DAVID CRANFORD WASHINGTON DC ,5.0,infantile
5791,Dr Dorothy J. Roach HOUSTON TX ,4.0,juvenile
5792,Dr MELISSA C. FISCHER Royal Oak MI ,2.75,lordosis
5793,Dr SARITHA C. THUMMA Spokane WA ,5.0,adolescent
5794,Dr Lyubov Y. Gorelik Brooklyn NY ,2.0,adult
5796,Mort Neek Oakville ON ,4.75,dextroscoliosisfunctional
5797,Dr Catherine McLeod Bridgewater NS ,3.25,dextroscoliosislevoscoliosisneuromuscular
5798,Dr Jeffrey A. Goldstein New York NY ,4.0,compensatory
5799,Dr Kishwar Shareef Randolph NJ ,3.25,dextroscoliosis
5800,Dr Joanna Keall Saskatoon SK ,5.0,levoscoliosis
5801,Dr Tatiana A. Wellens Bruschayt WINTER HAVEN FL ,4.0,kyphosis
5802,Dr EIMAN EL SAYED Winter Haven FL ,4.75,idiopathic
5803,Dr CAROLINE R. MOSHEL Medford NJ ,5.0,infantile
5804,Dr JOSHUA THOMAS FAIRFAX VA ,5.0,juvenile
5806,Dr MELISSA M. BOYETTE Bradenton FL ,5.0,adolescent
5807,Dr JENNIFER S. GLUECK HIGHLAND PARK IL ,4.0,adult
5808,Dr KATHERINE SZEMA BRONX NY ,5.0,dextroscoliosisstructuralcompensatory
5809,Dr Alejandro R. Calvo Kettering OH ,4.0,dextroscoliosisfunctional
5810,Dr David Kanawaty North York ON ,4.0,dextroscoliosislevoscoliosisneuromuscular
5811,Dr Patrick F. Reilly PENSACOLA FL ,4.5,compensatory
5812,Dr James E. White Chattanooga TN ,5.0,dextroscoliosis
5813,Dr Wirt Andy Hines Anacortes WA ,4.0,levoscoliosis
5814,Dr CRAIG T. ARNTZ Renton WA ,4.75,kyphosis
5815,Dr Himanshu Desai Epping NSW ,5.0,idiopathic
5816,dr amy sapodin new york ny us,5.0,infantile
5820,Dr Tarek A. Radwan Nashua NH ,5.0,adult
5821,Dr Betsy McCormick Tampa FL ,4.0,dextroscoliosisstructuralcompensatory
5822,Dr BRIAN SABB Ann Arbor MI ,5.0,dextroscoliosisfunctional
5824,Dr Patrick McKenna Edmonton AB ,5.0,compensatory
5826,Dr Fred Weksberg Toronto ON ,3.0,levoscoliosis
5828,dr w scout robinson knoxville tn us,5.0,idiopathic
5830,Dr Rachel Knight Melbourne VIC ,4.25,juvenile
5832,Dr HELEN E. WATT Scottsdale AZ ,2.75,adolescent
5834,dr caelin white calgary ab ca,5.0,dextroscoliosisstructuralcompensatory
5835,Dr Fadi N. Joudi Wichita KS ,4.5,dextroscoliosisfunctional
5836,dr saraga ha montreal ouest qc ca,4.75,dextroscoliosislevoscoliosisneuromuscular
5837,Dr Craig Bentham Victoria BC ,4.0,compensatory
5839,dr jen mutch montreal qc ca,5.0,levoscoliosis
5840,Dr Michael J. Nissenblatt EAST BRUNSWICK NJ ,4.5,kyphosis
5842,Dr NIBHA MEDIRATTA Clermont FL ,4.0,infantile
5843,Dr Nancy Cibotti Granof Boston MA ,4.75,juvenile
5844,Dr Matt E. Hipke Longview TX ,4.5,lordosis
5845,Dr Jeremie Hallett Kelowna BC ,5.0,adolescent
5846,Dr Kathleen C. Toomey Somerville NJ ,3.75,adult
5847,Dr Janet L. Chestnut Spokane WA ,4.75,dextroscoliosisstructuralcompensatory
5848,Dr Benjamin S. Citrin Mobile AL ,5.0,dextroscoliosisfunctional
5849,Dr Lorne Poon Edmonton AB ,4.0,dextroscoliosislevoscoliosisneuromuscular
5850,Dr David T. Weibel Baton Rouge LA ,4.25,compensatory
5852,Dr Paul M. Friedman Houston TX ,4.0,levoscoliosis
5853,Dr Danny Gagnon Montreal QC ,5.0,kyphosis
5854,Dr Keyvan Jahanbakhsh Staten Island NY ,4.75,idiopathic
5856,Dr Daniel P. Otchy Fairfax VA ,3.0,juvenile
5857,Dr James Brazeau Ottawa ON ,4.25,lordosis
5858,Dr Tara Campbell Toronto ON ,4.0,adolescent
5859,Dr Tahmina Amer Oakville ON ,4.0,adult
5860,Dr Alina Constantin Canmore AB ,4.0,dextroscoliosisstructuralcompensatory
5861,TINA D. ROWE ROCKWALL TX ,5.0,dextroscoliosisfunctional
5862,Dr Richard Parkinson Sydney NSW ,4.0,dextroscoliosislevoscoliosisneuromuscular
5863,Dr Wayne B. Eisman White Plains NY ,4.5,compensatory
5864,dr davinder sidhu burnaby bc ca,3.75,dextroscoliosis
5865,Dr Ritu KAPOOR Sterling VA ,5.0,levoscoliosis
5866,Dr Christopher Keith McSpadden Cedar Park TX ,4.5,kyphosis
5868,Dr CORY ALFERS Arlington VA ,4.0,infantile
5869,JEFFREY P. REYES Huntington Beach CA ,5.0,juvenile
5870,dr dr singh nd ottawa on ca,5.0,lordosis
5871,dr neil vora calgary ab ca,5.0,adolescent
5872,Dr AMI RAVAL Boston MA ,5.0,adult
5874,dr mireya senye brossard qc ca,4.75,dextroscoliosisfunctional
5875,Dr Marc R. Toglia GLEN RIDDLE LIMA PA ,1.5,dextroscoliosislevoscoliosisneuromuscular
5877,Dr David M. Grunkemeier Portland OR ,4.5,dextroscoliosis
5879,Dr Cameron Grant Vernon BC ,5.0,kyphosis
5881,dr michael cristani calgary ab ca,4.5,infantile
5882,Dr Christina L. Michaelis Houston TX ,2.75,juvenile
5883,Dr Paul L. Leong Sewickley PA ,4.0,lordosis
5885,Dr Will Mauch Pickering ON ,5.0,adult
5887,Dr Eunseok Oh Vienna VA ,4.25,dextroscoliosisfunctional
5888,dr miriam harel avon ct us,1.0,dextroscoliosislevoscoliosisneuromuscular
5889,Dr LEV ELTERMAN Skokie IL ,4.75,compensatory
5890,Dr Wei Wang Englewood NJ ,2.0,dextroscoliosis
5891,dr talal farouk mustafa ali st anthony nl ca,4.75,levoscoliosis
5892,dr anup patel orlando fl us,5.0,kyphosis
5893,dr husain khambati langley bc ca,5.0,idiopathic
5894,Dr Atif Haque Fort Worth TX ,4.0,infantile
5897,Dr SHALIN K. PATEL Dallas TX ,5.0,adolescent
5898,Dr CARL RIDDICK PORTLAND OR ,4.5,adult
5899,dr dana cooper sudbury on ca,5.0,dextroscoliosisstructuralcompensatory
5900,Dr Steven M. Krakora WASHINGTON PA ,5.0,dextroscoliosisfunctional
5901,Dr Ruby C. Reyes Edison NJ ,3.0,dextroscoliosislevoscoliosisneuromuscular
5904,Dr Mark J. Domet Boys Town NE ,4.5,levoscoliosis
5905,Dr Andrew M. Jasek Janesville WI ,4.0,kyphosis
5906,Dr Donald B. Colvin Fairfax VA ,4.0,idiopathic
5907,Dr Mark R. Jaffe Dallas TX ,5.0,infantile
5908,Dr Sujit R. Varma Edina MN ,4.0,juvenile
5909,Dr DAVID B. ADAMS Atlanta GA ,5.0,lordosis
5911,Dr Michael Prytula St. Catharines ON ,3.0,adult
5912,Dr Christine Bovo Montreal QC ,4.75,dextroscoliosisstructuralcompensatory
5913,Dr Teddy Chung Oakville ON ,3.75,dextroscoliosisfunctional
5914,Dr Christopher L. Tye Colleyville TX ,4.75,dextroscoliosislevoscoliosisneuromuscular
5918,Dr Harpreet Bajaj Toronto ON ,2.0,kyphosis
5919,Dr CHRISTINE A. QUATRO Hurst TX ,2.0,idiopathic
5920,Dr Mark J. Seifert Phoenix AZ ,4.75,infantile
5921,Dr ELLEN I. VORONOV Downers Grove IL ,1.0,juvenile
5922,Dr REZWAN H. CHOWDHURY Scottsdale AZ ,5.0,lordosis
5924,dr nirmala chandrasekaran toronto on ca,4.5,adult
5927,dr sarah martins calgary ab ca,5.0,dextroscoliosislevoscoliosisneuromuscular
5928,Dr AISHA H. SHAREEF Munster IN ,5.0,compensatory
5929,Dr Justin M. Skripak Hoboken NJ ,4.0,dextroscoliosis
5930,Dr Amaryllis Pascual Aventura FL ,4.0,levoscoliosis
5931,Dr HINA S. HASSAN HOUSTON TX ,4.75,kyphosis
5932,Dr Joseph A. Donnellan hillsborough NJ ,3.75,idiopathic
5933,dr sukhdeep gill abbotsford bc ca,4.0,infantile
5934,Dr WEIHONG ZHENG Needham MA ,4.0,juvenile
5935,dr ripple sharma greenbrae ca us,5.0,lordosis
5936,dr sanjay s reddy,4.25,adolescent
5938,Dr Mark Boyd Montreal QC ,4.25,dextroscoliosisstructuralcompensatory
5940,Dr Theresa Taylor Calgary AB ,4.0,dextroscoliosislevoscoliosisneuromuscular
5942,Dr FARZAM KASHANIAN Brooklyn NY ,3.25,dextroscoliosis
5943,Dr Thuy Tu Nguyen Orleans ON ,4.5,levoscoliosis
5944,dr jeanie yuh mississauga on ca,4.75,kyphosis
5946,RENEE DENOBREGA READING PA ,5.0,infantile
5947,Dr O. Alex Lesani Las Vegas NV ,4.0,juvenile
5948,Dr CHARLES B. LOVELADY SCOTTSBORO AL ,4.75,lordosis
5949,Dr Wendy C. Huhn Orlando FL ,1.0,adolescent
5950,Dr George Bolen Bethesda MD ,4.0,adult
5951,Dr Aaron Samanta Kitchener ON ,5.0,dextroscoliosisstructuralcompensatory
5952,Dr Fares Sbaiti Burlington ON ,5.0,dextroscoliosisfunctional
5953,Dr T. ADAM Cotsen Los Angeles CA ,5.0,dextroscoliosislevoscoliosisneuromuscular
5954,dr jenna oshea florissant mo us,5.0,compensatory
5956,Dr Magda Barnard Bedford NS ,4.75,levoscoliosis
5957,Dr Tanya Sehgal Delhi DL ,4.25,kyphosis
5958,Dr NAVIN ARORA Newport News VA ,5.0,idiopathic
5960,Dr Carlos J. Piniella Miami FL ,4.0,juvenile
5961,Dr Henry E. Aryan Fresno CA ,5.0,lordosis
5964,Dr MICHAEL B. JOHNSON Los Angeles CA ,4.75,dextroscoliosisstructuralcompensatory
5965,Dr ROMAN GRINBERG STATEN ISLAND NY ,4.75,dextroscoliosisfunctional
5968,Dr GERI E. JUSTICE TIFTON GA ,5.0,dextroscoliosis
5969,Dr ROBERT L. VITALETTI Denver CO ,4.0,levoscoliosis
5970,Dr Myriam Mondestin Sorrentino VOORHEES NJ ,4.0,kyphosis
5971,Dr LOUAY TOMA WALNUT CREEK CA ,5.0,idiopathic
5972,Dr Linda L. Liu Scottsdale AZ ,4.75,infantile
5973,Dr Anna I. Wooten Sewickley PA ,4.5,juvenile
5974,Dr YOUSSEF S. RIZK clinton township MI ,5.0,lordosis
5975,Dr Peter Dukesz Newmarket ON ,4.75,adolescent
5976,dr mohamed salyani oakville on ca,4.75,adult
5977,Dr Jonathan D. Hoffberger Plantation FL ,3.75,dextroscoliosisstructuralcompensatory
5979,Dr Debra L. Bunger Aptos CA ,2.5,dextroscoliosislevoscoliosisneuromuscular
5981,dr katherine kuehn vancouver bc ca,4.5,dextroscoliosis
5983,Dr Joseph B. Stanford WEST JORDAN UT ,4.75,kyphosis
5985,Dr David B. Argo Cincinnati OH ,5.0,infantile
5986,Dr Alexander Shifrin BROOKLYN NY ,4.75,juvenile
5987,dr alison mcguire ottawa on ca,5.0,lordosis
5989,Dr LARISSE K. LEE Los Angeles CA ,4.75,adult
5990,dr mei gao princeton nj us,5.0,dextroscoliosisstructuralcompensatory
5991,Dr CHAD R. FOSTER TEMPE AZ ,5.0,dextroscoliosisfunctional
5992,Dr Andrew Han Abbotsford BC ,4.0,dextroscoliosislevoscoliosisneuromuscular
5993,Dr FREDERICK S. SONG Princeton NJ ,5.0,compensatory
5994,Dr JASON GREEN Fort Lauderdale FL ,4.5,dextroscoliosis
5995,John Zhang Boston MA ,4.75,levoscoliosis
5996,Dr Jordan L. Weinstein DOWNERS GROVE IL ,4.0,kyphosis
5998,Dr PETER S. CHA Cincinnati OH ,5.0,infantile
5999,Dr SAIMA KAMAL St. Louis MO ,5.0,juvenile
6000,Dr Lana Rozenberg New York NY ,5.0,lordosis
6001,Dr CARYN L. SILVER Sarasota FL ,3.0,adolescent
6003,Dr Andrea Veisman Toronto ON ,5.0,dextroscoliosisstructuralcompensatory
6006,Dr NICKHIL GUPTA PISCATAWAY NJ ,4.5,compensatory
6008,Dr Raj Satkunasivam Los Angeles CA ,5.0,levoscoliosis
6009,Dr Ken Nakamura Toronto ON ,5.0,kyphosis
6010,Dr ELIZABETH H. KATZ ATHENS GA ,3.75,idiopathic
6012,Dr GRACIE STURDIVANT McAllen TX ,3.0,juvenile
6013,dr charles turnermd lafayette in us,2.25,lordosis
6014,dr rachel shin london on ca,5.0,adolescent
6015,Dr FREDA LEVY Dallas TX ,5.0,adult
6016,Dr Susan Ghazali Winnipeg MB ,3.75,dextroscoliosisstructuralcompensatory
6017,Dr Niharika Jain Jabalpur MP ,5.0,dextroscoliosisfunctional
6018,Dr Mark Manning Guelph ON ,5.0,dextroscoliosislevoscoliosisneuromuscular
6019,Dr WASSIA KHAJA Jacksonville FL ,5.0,compensatory
6020,Dr CHRISTY S. RAINEY Branson MO ,3.0,dextroscoliosis
6021,Dr Darsit K. Shah Shrewsbury Township NJ ,4.5,levoscoliosis
6023,Dr Michael T. Clarke Syracuse NY ,5.0,idiopathic
6024,debra woodard sykesville md us,5.0,infantile
6025,Dr Perry M. Herman Monroe Township NJ ,4.75,juvenile
6026,Dr Leonard T. Hackett Fresno CA ,4.75,lordosis
6027,Dr Caroline Tosoni Ottawa ON ,5.0,adolescent
6028,Dr S. BRENDA Moorthy Glendale AZ ,4.0,adult
6029,Dr Tomas A. Gonzalez Harlingen TX ,5.0,dextroscoliosisstructuralcompensatory
6030,eric lutzwick bismarck nd us,5.0,dextroscoliosisfunctional
6032,Dr Gregory L. Jewell St. Louis MO ,5.0,compensatory
6033,Zhi Liang Huo Winter Park FL ,4.0,dextroscoliosis
6034,Dr Robert D. Oates Boston MA ,4.0,levoscoliosis
6037,Dr NASIR A. SIDDIQUI Pittsburgh PA ,5.0,infantile
6038,Dr Kenton T. Bruice Denver CO ,4.0,juvenile
6039,Dr KRISTOFFER RYAN DE LARA New Brunswick NJ ,5.0,lordosis
6040,Dr Ashlin Alexander Toronto ON ,4.0,adolescent
6041,Dr SANDRA LETICIA CROSARA Des Moines IA ,4.5,adult
6042,Dr Kimberly Sackheim New York NY ,5.0,dextroscoliosisstructuralcompensatory
6043,Dr Richard P. Winne MORRISTOWN NJ ,3.75,dextroscoliosisfunctional
6044,dr issam loubani london on ca,5.0,dextroscoliosislevoscoliosisneuromuscular
6045,Dr ALLEN R. DORSETT Pasadena TX ,5.0,compensatory
6046,Dr Steven C. Allgood Mason City IA ,5.0,dextroscoliosis
6048,dr james lee montreal qc ca 2,4.75,kyphosis
6049,Dr Kathleen M. Doody BEDFORD TX ,4.5,idiopathic
6050,Dr Vincent della Zazzera Ottawa ON ,4.75,infantile
6051,Dr Kathryn Becker Calgary AB ,4.5,juvenile
6052,dr yajuvendra bisht sydney nsw au,4.0,lordosis
6053,Dr Justin Epstein Burlington ON ,4.5,adolescent
6056,dr alyson howatt edmonton ab ca,5.0,dextroscoliosisfunctional
6057,Dr Paramjit Perry Sahni Calgary AB ,4.5,dextroscoliosislevoscoliosisneuromuscular
6058,Dr NATACHA FALCON PHILADELPHIA PA ,5.0,compensatory
6063,dr scotty bolding springdale ar us,5.0,infantile
6064,dr gavin a falk kalispell mt us,5.0,juvenile
6065,OLIVIA KROENING ROCHE OREGON CITY OR ,4.75,lordosis
6066,Dr Julian De Silva London ENG ,4.5,adolescent
6067,Dr Mark Eltis Toronto ON ,4.5,adult
6068,Dr Ales Aliashkevich Melbourne VIC ,5.0,dextroscoliosisstructuralcompensatory
6069,Dr Mimi Cho Edina MN ,4.75,dextroscoliosisfunctional
6071,Dr Arif Bungash St. John NB ,5.0,compensatory
6072,Dr Wendy R. Bond Cape Coral FL ,4.25,dextroscoliosis
6073,Dr LAWRENCE H. NEWMAN Las Vegas NV ,4.0,levoscoliosis
6075,Dr Richard J. Teff Billings MT ,4.75,idiopathic
6076,Dr Erik Van Kleek Newberg OR ,4.5,infantile
6077,Dr Meaghan Mccollum Calgary AB ,4.75,juvenile
6078,Dr Daniel F. Kelly Santa Monica CA ,5.0,lordosis
6079,Dr Salvatore V. Raccuia Brooklyn NY ,5.0,adolescent
6080,STACEY K. YEPES Dallas TX ,5.0,adult
6082,dr nakul mahajan staten island ny us,5.0,dextroscoliosisfunctional
6083,Dr Elizabeth Hall Findlay Banff AB ,5.0,dextroscoliosislevoscoliosisneuromuscular
6084,Dr Michael F. Bardwil Houston TX ,2.25,compensatory
6085,Dr Pierre Picard Hamilton ON ,4.0,dextroscoliosis
6086,Dr Jessica Nesbitt Red Deer AB ,5.0,levoscoliosis
6087,Dr John R. Miklos ALPHARETTA GA ,5.0,kyphosis
6088,Dr Caroline B. Huang ARLINGTON VA ,2.0,idiopathic
6089,Dr TATIANA FLEISCHMAN Darien CT ,4.0,infantile
6090,Dr Fady Ghaly Weyburn SK ,3.0,juvenile
6091,Dr KRISTYN PISTONE HAVERHILL MA ,4.5,lordosis
6092,Dr MARK I. Block Hollywood FL ,5.0,adolescent
6094,Dr David Morrow Toronto ON ,4.75,dextroscoliosisstructuralcompensatory
6095,Dr Sameer Sekhon Brampton ON ,5.0,dextroscoliosisfunctional
6096,Dr Michael Stifelman New York NY ,4.0,dextroscoliosislevoscoliosisneuromuscular
6097,dr paul young bedford ns ca,4.75,compensatory
6098,Dr Joseph K. Hyon Park Ridge NJ ,3.0,dextroscoliosis
6099,Dr Ali Nasser Calgary AB ,5.0,levoscoliosis
6101,Dr Jennifer K. Kramer Bellmore NY ,5.0,idiopathic
6102,dr hamid tajbakhsh burnaby bc ca,5.0,infantile
6105,RACHEL BONNER ASHBURN VA ,5.0,adolescent
6106,Dr Kristin S. Nesbitt Frederick MD ,2.75,adult
6107,dr mike forseth calgary ab ca,5.0,dextroscoliosisstructuralcompensatory
6108,Dr Mark Gudesblatt BAY SHORE NY ,3.25,dextroscoliosisfunctional
6109,Dr ERIC A. HELLER Boca Raton FL ,4.25,dextroscoliosislevoscoliosisneuromuscular
6110,Dr Shaad B. Bidiwala Dallas TX ,4.75,compensatory
6111,Dr Gary G. King Orlando FL ,5.0,dextroscoliosis
6112,Dr John C. Tanner JACKSONVILLE BEACH FL ,3.75,levoscoliosis
6113,Dr THOMAS M. HECKER Fort Collins CO ,4.0,kyphosis
6114,Dr Patricia A. Rodriguez Arlington VA ,2.5,idiopathic
6115,Dr Michael Rondinelli Sarnia ON ,4.0,infantile
6116,Dr Lisa Keen Calgary AB ,4.75,juvenile
6117,Dr Marc D. Glashofer Garden City NY ,5.0,lordosis
6118,dr dan nayot toronto on ca,4.0,adolescent
6119,Dr James A. Howard Tifton GA ,4.0,adult
6121,Dr Paul Clark Mississauga ON ,4.25,dextroscoliosisfunctional
6122,dr mayadevi pande london on ca,5.0,dextroscoliosislevoscoliosisneuromuscular
6123,Dr Philip J. Vahab Herndon VA ,4.5,compensatory
6125,Dr Amit R. Patel Hinsdale IL ,5.0,levoscoliosis
6126,Dr Aimee Ferrell Baton Rouge LA ,4.5,kyphosis
6128,Dr Gerard J. Gianoli Covington LA ,4.75,infantile
6129,Dr Chris Pollock New Westminster BC ,5.0,juvenile
6130,Dr Joseph T. Lee Arlington VA ,4.5,lordosis
6131,Dr Samuel Tarantino TAMPA FL ,4.75,adolescent
6132,Dr Jonathan S. Hott Phoenix AZ ,5.0,adult
6134,dr nichelle wilson douglasville ga us,5.0,dextroscoliosisfunctional
6135,Dr Poonam Batra Toronto ON ,4.0,dextroscoliosislevoscoliosisneuromuscular
6136,Dr Chris Yavis Calgary AB ,5.0,compensatory
6137,Dr Kaes Al Ali Port Hope ON ,4.75,dextroscoliosis
6138,Dr KATHLEEN L. MUNSELL Fresno CA ,4.75,levoscoliosis
6139,Dr Dany Morais Quebec QC ,4.0,kyphosis
6140,dr theresa higgo bedfordview gt za,4.0,idiopathic
6142,Dr Michael J. ADLER Sioux Falls SD ,4.75,juvenile
6143,Zhi Ping Ren Scarborough ON ,4.75,lordosis
6146,Dr Terry L. Beck Midland TX ,4.0,dextroscoliosisstructuralcompensatory
6148,Dr Lanny Hecker Phoenix AZ ,3.0,dextroscoliosislevoscoliosisneuromuscular
6149,Dr JOHN R. KUKUCKA Manasquan NJ ,5.0,compensatory
6150,Dr SERENA L. DOVEY AURORA CO ,5.0,dextroscoliosis
6151,Dr Wendell A. Gibby Provo UT ,3.0,levoscoliosis
6155,Dr Jeffrey H. Lumerman GARDEN CITY NY ,4.0,juvenile
6156,Dr Karen A. Wirtshafter Parsippany NJ ,4.0,lordosis
6158,Dr Brodie Ramin Ottawa ON ,4.0,adult
6159,Dr Ken Marenco Orleans ON ,5.0,dextroscoliosisstructuralcompensatory
6160,dr alysha hirjee edmonton ab ca,4.0,dextroscoliosisfunctional
6161,Dr Sandra P. Fallon Santa Monica CA ,5.0,dextroscoliosislevoscoliosisneuromuscular
6162,dr john t paruch florissant mo us,5.0,compensatory
6163,Dr Randall J. Bremner Decorah IA ,4.0,dextroscoliosis
6165,Dr Naeem Z. Abdulla Toronto ON ,4.75,kyphosis
6167,Dr Rex Hawthorne Vernon BC ,4.75,infantile
6168,dr alberto rivera maldonado cincinnati oh us,5.0,juvenile
6169,Dr George D. Kofinas Brooklyn NY ,4.25,lordosis
6170,Dr Randy Rosenberg HUNTINGDON VALLEY PA ,3.25,adolescent
6172,Dr CHARITY H. GRANNIS DALLAS TX ,4.25,dextroscoliosisstructuralcompensatory
6173,Dr Fiona Soong Toronto ON ,4.5,dextroscoliosisfunctional
6174,dr kiera buchanan brisbane qld au,4.75,dextroscoliosislevoscoliosisneuromuscular
6175,Dr ARMIN V. OSKOUEI Atlanta GA ,3.25,compensatory
6176,Dr AMEETA A. WALIA LAKE SUCCESS NY ,3.75,dextroscoliosis
6177,Dr Nancy Chung North York ON ,4.5,levoscoliosis
6179,Dr Garrett H. SMITH STERLING HEIGHTS MI ,4.0,idiopathic
6182,Dr Richard T. Hung Houston TX ,5.0,lordosis
6183,Dr Kamyar Cohanshohet Beverly Hills CA ,4.5,adolescent
6184,Dr HALEEM N. CHAUDHARY Cincinnati OH ,5.0,adult
6186,Dr JASON E. BERILGEN The Woodlands TX ,5.0,dextroscoliosisfunctional
6188,ca on toronto mehdi adibrad,5.0,compensatory
6189,Dr RONAK A. PATEL Jacksonville FL ,5.0,dextroscoliosis
6190,Dr JAMES D. GOULD Festus MO ,5.0,levoscoliosis
6191,Dr Aliya Rajwani Calgary AB ,5.0,kyphosis
6192,Dr Ghassan K. Bejjani Pittsburgh PA ,4.0,idiopathic
6193,giti caravan saskatoon sk ca,4.5,infantile
6194,Dr Nancy R. Ekelman NEW YORK NY ,4.0,juvenile
6195,Dr REENA Pathak Windsor ON ,5.0,lordosis
6196,Dr Edward Chan Markham ON ,4.75,adolescent
6197,Dr NEDA NOSRATI BELLAIRE TX ,5.0,adult
6198,Dr Payal S. PATEL SAFETY HARBOR FL ,5.0,dextroscoliosisstructuralcompensatory
6199,Dr Fernando Maria Velez Gonzalez Valleyfield QC ,4.5,dextroscoliosisfunctional
