Doctor ID,Doctor Name,Doctor Score,Scoliosis Type
3952,Dr Rasik Morzaria Toronto ON ,4.0,compensatory
3953,Dr SUBRAMANIAN SIVARAJAN Kansas City MO ,3.0,dextroscoliosis
3954,Dr Robert M. Jackson Palmdale CA ,4.25,levoscoliosis
3955,Dr Eric Sommer Cortlandt Manor NY ,4.5,kyphosis
3956,dr ashley bayer coral springs fl us,3.0,idiopathic
3957,Dr Gregory A. Komenda Bellevue WA ,4.5,infantile
3958,Dr MARIANNE M. URBANSKI Meriden CT ,4.0,juvenile
3959,Dr Lisa Renfro Annapolis MD ,3.0,lordosis
3960,Mary Wong Toronto ON ,4.75,adolescent
3961,Dr Romina Perri Montreal QC ,5.0,adult
3962,Dr Alan M. Greenberg Frisco TX ,5.0,dextroscoliosisstructuralcompensatory
3963,dr li chai toronto on ca,5.0,dextroscoliosisfunctional
3965,Dr Gary L. Clayman Houston TX ,5.0,compensatory
3966,jilanne rose tempe az us,5.0,dextroscoliosis
3967,Dr Laurie L. Ackerman Indianapolis IN ,4.75,levoscoliosis
3968,Dr JEAN LOUIS BENAE Hattiesburg MS ,4.0,kyphosis
3969,Dr Martin G. Paul Washington DC ,4.75,idiopathic
3970,Dr Mark J. Pyle Buckeye AZ ,4.75,infantile
3972,Dr Charles J. Sprague Omaha NE ,4.0,lordosis
3973,Dr MEGAN R. WILLIAMS SAN ANTONIO TX ,5.0,adolescent
3976,Dr Joseph J. Friedlich Brampton ON ,4.5,dextroscoliosisfunctional
3977,dr kelsey bennett montreal qc ca,5.0,dextroscoliosislevoscoliosisneuromuscular
3978,Dr JEFF BECK BLOOMINGTON IN ,5.0,compensatory
3980,Dr Hafez Daneshvar Alexandria VA ,3.0,levoscoliosis
3982,Dr E. Lee  Hardin Grand Junction CO ,4.0,idiopathic
3983,Dr BRIAN T. BLATT Plano TX ,4.75,infantile
3984,Dr David WEINSTEIN New York NY ,4.0,juvenile
3985,dr christian a hernandez winter park fl us,4.5,lordosis
3986,dr amanda ball lafayette in us,3.75,adolescent
3987,Dr Peter Fonti London ON ,5.0,adult
3988,Dr Moshe Ephrat Lake Success NY ,4.5,dextroscoliosisstructuralcompensatory
3989,Dr Mark A. Heitner BURLINGAME CA ,4.0,dextroscoliosisfunctional
3991,dr david milanovich courtenay bc ca,4.25,compensatory
3992,dr james c thompson fort worth tx us,5.0,dextroscoliosis
3994,Dr Helene Grubisa Oakville ON ,5.0,kyphosis
3998,Dr Candace S. Cooley Breckenridge CO ,3.0,lordosis
3999,Dr Isam Y. Balat Houston TX ,4.0,adolescent
4000,dr gregory hannon edina mn us,4.75,adult
4001,Dr William F. Bohlen Greenville SC ,4.75,dextroscoliosisstructuralcompensatory
4002,Dr Daniel J. FARKAS Laguna Hills CA ,5.0,dextroscoliosisfunctional
4003,Dr Charles E. Crutchfield EAGAN MN ,4.0,dextroscoliosislevoscoliosisneuromuscular
4004,Dr TATIANA DOUBNOVA SAN FRANCISCO CA ,4.75,compensatory
4005,dr peter watson calgary ab ca,5.0,dextroscoliosis
4007,Dr BRUCE M. ROTHSCHILD Lawrence KS ,2.0,kyphosis
4008,Dr Ray Daly Windsor ON ,4.0,idiopathic
4009,Dr Gary J. Rothfeld New York NY ,5.0,infantile
4010,Dr Patricia Maeso Houston TX ,3.75,juvenile
4011,Dr Reet Dhillon Grande Prairie AB ,4.0,lordosis
4012,Dr BEIQING PAN SOMERVILLE NJ ,3.25,adolescent
4013,Dr Peter Ursel Lindsay ON ,4.5,adult
4014,Dr Douglas D. Altchek New York NY ,3.5,dextroscoliosisstructuralcompensatory
4015,Dr Margus Heinmaa Toronto ON ,5.0,dextroscoliosisfunctional
4016,Dr JARED BAUERLE LAS CRUCES NM ,5.0,dextroscoliosislevoscoliosisneuromuscular
4017,Dr Shetal M. Mansuria Livingston NJ ,3.0,compensatory
4019,Dr Natchez Trey Morice Morgan City LA ,5.0,levoscoliosis
4021,Dr STEPHEN J. LONGOBARDI Union NJ ,5.0,idiopathic
4022,dr maierhoffer regina sk ca,5.0,infantile
4025,Dr Justin A. Willer BROOKLYN NY ,3.0,adolescent
4026,Dr Joseph E. Cangas Columbia IL ,4.0,adult
4027,Dr Brett C. Lewis Atlanta GA ,5.0,dextroscoliosisstructuralcompensatory
4028,Dr Eric Meen Winnipeg MB ,4.0,dextroscoliosisfunctional
4029,Dr Karim Somani Brockville ON ,5.0,dextroscoliosislevoscoliosisneuromuscular
4031,Dr TARIQ HALIM PARRISH FL ,4.5,dextroscoliosis
4032,Dr ALLISON B. SUTTON SAN ANTONIO TX ,4.0,levoscoliosis
4033,Dr Kiran V. Patel New York NY ,2.5,kyphosis
4038,Dr Michael Chu Calgary AB ,5.0,adolescent
4039,Dr Alexis G. Thomas Kansas City MO ,5.0,adult
4040,Dr Jill A. Collier Toms River NJ ,3.0,dextroscoliosisstructuralcompensatory
4041,Dr Dean E. Dagermangy Loma Linda CA ,4.0,dextroscoliosisfunctional
4047,Dr Bibi I. Hasnain O_apos_Fallon MO ,1.5,idiopathic
4048,Dr Beau Hightower Albuquerque NM ,4.75,infantile
4049,Dr Grant D. Sievertsen Hinsdale IL ,1.25,juvenile
4051,Dr Gary C. Bellman Woodland Hills CA ,3.0,adolescent
4052,Dr FLORENCE SHUM New York NY ,4.5,adult
4053,Dr Gerald Tullio Brampton ON ,4.0,dextroscoliosisstructuralcompensatory
4054,Dr Nathan E. Nachlas Boca Raton FL ,4.75,dextroscoliosisfunctional
4055,Dr Aaron Styer Boston MA ,5.0,dextroscoliosislevoscoliosisneuromuscular
4056,Dr John M. Ross Palestine TX ,4.75,compensatory
4057,Dr BRIGITTA WESTALL Long Beach CA ,4.75,dextroscoliosis
4058,Dr Jamie C. Joyce St. Louis MO ,4.75,levoscoliosis
4059,Dr EVELYN ECKERT WHIPPANY NJ ,3.0,kyphosis
4061,dr mostafa altalibi calgary ab ca,4.0,infantile
4062,Dr Michael S. Schottenstein Columbus OH ,4.0,juvenile
4063,Dr SRIVALLI GOPALUNI SPOKANE WA ,4.0,lordosis
4064,Dr Fanny Lamb Montreal QC ,3.0,adolescent
4065,Dr Sudhir S. Athni Macon GA ,3.0,adult
4067,Dr Paul Catania London ON ,5.0,dextroscoliosisfunctional
4068,Dr Athar Butt Langley BC ,5.0,dextroscoliosislevoscoliosisneuromuscular
4069,Dr Mohamed Abdel Fattah North Vancouver BC ,4.0,compensatory
4070,Dr Erin Mckenzie Calgary AB ,4.5,dextroscoliosis
4071,Dr Michelle Couto Coquitlam BC ,5.0,levoscoliosis
4072,Dr Rinku V. Mehta Frisco TX ,3.5,kyphosis
4073,Dr Manish R. Patel Sarasota FL ,4.75,idiopathic
4074,Dr James Chih Hsien Ko Toronto ON ,4.5,infantile
4075,Dr Prashant P. Ponda New Windsor NY ,4.0,juvenile
4076,Dr Kyle Burns Burnaby BC ,4.0,lordosis
4077,Dr SACHIN M. SHRIDHARANI NEW YORK NY ,5.0,adolescent
4078,Dr Bayoan D. Martinez Cruz Leesburg FL ,4.0,adult
4079,Dr CRAIG D. KAIN Long Beach CA ,5.0,dextroscoliosisstructuralcompensatory
4080,Dr Steven Cataldo Joliet IL ,4.0,dextroscoliosisfunctional
4082,Dr David Godin New York NY ,4.0,compensatory
4083,Dr David H. Ciocon Hackensack NJ ,4.0,dextroscoliosis
4085,Dr ALLISON RODGERS ORLAND PARK IL ,2.25,kyphosis
4086,Dr Ramon Castellanos Miami FL ,4.5,idiopathic
4087,dr anjelika alechina etobicoke on ca,5.0,infantile
4089,Dr Sahar Rakhshanfar RICHMOND CA ,5.0,lordosis
4090,Dr Sangeeta Bajaj Brampton ON ,5.0,adolescent
4091,Dr Odette N. Limosnero Flower Mound TX ,3.75,adult
4092,Dr Sharna Striar New York NY ,4.0,dextroscoliosisstructuralcompensatory
4093,Dr SCOTT D. Urban West Jordan UT ,5.0,dextroscoliosisfunctional
4094,Dr Joel E. Chodos Newark DE ,4.5,dextroscoliosislevoscoliosisneuromuscular
4096,dr linda lee edmonton ab ca,4.25,dextroscoliosis
4097,Dr Jose Rodriguez Montreal QC ,5.0,levoscoliosis
4099,dr lindsey yarnell portland or us,5.0,idiopathic
4100,dr jagdeesh singh dhaliwal melbourne vic au,5.0,infantile
4101,Dr SWATI ELLENDULA Vicksburg MS ,5.0,juvenile
4102,Dr Sue Ann Wee New York NY ,4.75,lordosis
4104,Dr Juliette L. Wait Dallas TX ,3.75,adult
4106,Dr Gisa A. Schunn Richmond VA ,1.5,dextroscoliosisfunctional
4107,Dr Jenny Jun Toronto ON ,4.75,dextroscoliosislevoscoliosisneuromuscular
4108,dr dustin wilkes weatherford tx us,4.5,compensatory
4109,Dr Alejandra Piniella Miami FL ,4.75,dextroscoliosis
4110,Dr Nicholas J. Vogelzang Las Vegas NV ,4.75,levoscoliosis
4111,Dr Jason Lee Toronto ON ,4.0,kyphosis
4113,Dr Betty A. Hinderks Davis Sun City West AZ ,5.0,infantile
4114,Dr Neeru Gupta Toronto ON ,4.75,juvenile
4115,Dr Jacob E. Markovitz Englewood NJ ,4.5,lordosis
4116,Dr ROBERT E. GOLDER Kansas City MO ,5.0,adolescent
4117,Dr Lori Goldenberg Markham ON ,4.0,adult
4118,Dr Joel Villeneuve Ottawa ON ,4.0,dextroscoliosisstructuralcompensatory
4119,Dr Patrick M. Ambrosio Old Bridge NJ ,4.0,dextroscoliosisfunctional
4120,Dr Mark Cohen Montreal QC ,5.0,dextroscoliosislevoscoliosisneuromuscular
4121,dr rachel gordon dallas tx us,5.0,compensatory
4122,Dr Mary C. O_apos_Toole Laguna Hills CA ,4.25,dextroscoliosis
4123,dr lemuel sarvida chandigarh pb in,5.0,levoscoliosis
4124,Dr David E. Rojer Linden NJ ,5.0,kyphosis
4125,Dr FREDERIC Kass New York NY ,5.0,idiopathic
4126,dr anne brawner namnoum atlanta ga us,5.0,infantile
4127,Dr Timothy R. Yeko Tampa FL ,5.0,juvenile
4128,Dr David Azouz Dallas TX ,4.0,lordosis
4129,Dr WALID A. OSTA CANTON MI ,4.0,adolescent
4130,Dr Norm Grayston Yorkton SK ,4.25,adult
4131,Dr Reza Shahim North Little Rock AR ,4.0,dextroscoliosisstructuralcompensatory
4132,Dr Shaul Dwosh Thornhill ON ,3.75,dextroscoliosisfunctional
4133,Dr Todd J. Brennan Tampa FL ,4.5,dextroscoliosislevoscoliosisneuromuscular
4134,dr ainah tan glen ellyn il us,5.0,compensatory
4136,Dr PEGGY J. STERLING Wesley Chapel FL ,5.0,levoscoliosis
4138,Dr Marc Allen Commack NY ,5.0,idiopathic
4140,dr arif karmali calgary ab ca,4.25,juvenile
4141,Dr Tara Guthrie Calgary AB ,4.75,lordosis
4142,Dr Dennis A. Burachinsky Bridgewater NJ ,5.0,adolescent
4143,Dr SYED SHARIQ SAGHIR Plano TX ,5.0,adult
4144,Dr Jason M. Jacobs Denver CO ,4.5,dextroscoliosisstructuralcompensatory
4145,dr valery bergeron montreal qc ca,5.0,dextroscoliosisfunctional
4146,Dr Michael G. Wayne New York NY ,4.0,dextroscoliosislevoscoliosisneuromuscular
4147,dr dr jason p brinton orlando fl us,5.0,compensatory
4148,Dr Timothy B. McConnell Cincinnati OH ,5.0,dextroscoliosis
4149,Dr Valerie K. Lyon New York NY ,4.0,levoscoliosis
4151,Dr OLUFENWA F. MILHOUSE CHICAGO IL ,5.0,idiopathic
4152,dr michael colin new york ny us,5.0,infantile
4153,Dr Kimberli S. Cox Peoria AZ ,4.75,juvenile
4155,Dr Callum Pearce Fremantle WA ,4.0,adolescent
4156,Dr Jonathan Albilia Montreal QC ,4.25,adult
4157,Dr Richard A. DiGioia Washington DC ,3.25,dextroscoliosisstructuralcompensatory
4159,Dr Rebecca J. Kurzon Winter Park FL ,3.0,dextroscoliosislevoscoliosisneuromuscular
4160,Dr Kirk Dr. Roth Cambridge ON ,4.0,compensatory
4161,dr timothy oleary ottawa on ca,5.0,dextroscoliosis
4162,Dr Ralph Zipper Melbourne FL ,2.75,levoscoliosis
4163,Dr JEFFREY C. CONFORTI CLIFTON NJ ,4.75,kyphosis
4165,Dr Sonia Leziy North Vancouver BC ,4.75,infantile
4166,Dr ERIC J. ABRAMS Princeton NJ ,5.0,juvenile
4167,Dr Joseph Parravano Cobourg ON ,5.0,lordosis
4168,Dr Barry J. Riskin Champaign IL ,3.75,adolescent
4169,dr allykhan lila calgary ab ca,5.0,adult
4170,Dr J. Morgan O_apos_Donoghue Sarasota FL ,4.0,dextroscoliosisstructuralcompensatory
4171,dr ligaya buchbinder md boca raton fl us,5.0,dextroscoliosisfunctional
4172,Dr Martha M. Murray Boston MA ,4.25,dextroscoliosislevoscoliosisneuromuscular
4173,Dr Michael L. Traub New York NY ,5.0,compensatory
4174,Dr Grace K. Kim Las Vegas NV ,5.0,dextroscoliosis
4175,Dr Terry L. Simpson Phoenix AZ ,3.0,levoscoliosis
4176,Dr Warren Cohen Calgary AB ,4.0,kyphosis
4177,Dr Dax K. Trujillo Tucson AZ ,2.5,idiopathic
4178,Dr LESLIE HOLCOMBE Arlington VA ,5.0,infantile
4179,Dr Kevin S. Gavin ALGONQUIN IL ,4.75,juvenile
4181,Dr MICHAEL L. FROM CHINLE AZ ,4.5,adolescent
4182,dr amanda perizzolo calgary ab ca,4.75,adult
4183,Dr Larissa Camejo STUART FL ,3.25,dextroscoliosisstructuralcompensatory
4185,Dr MAULIK K. BHALANI Tampa FL ,4.0,dextroscoliosislevoscoliosisneuromuscular
4186,Dr Robert Barron Concord ON ,4.0,compensatory
4187,Dr GABY D. DOUMIT Cleveland OH ,5.0,dextroscoliosis
4188,Dr DORETTE NOORHASAN FRISCO TX ,3.25,levoscoliosis
4189,Dr ELIEZER HALPERT New York NY ,3.0,kyphosis
4190,Dr Matthew S. Wilson West Valley City UT ,4.0,idiopathic
4191,Dr JESSICA B. JAMESON COEUR D ALENE ID ,4.75,infantile
4192,Dr Waleed M. Abdelghani Hackensack NJ ,5.0,juvenile
4193,BETH M. SCHRAGE Edina MO ,5.0,lordosis
4195,Dr Frank J. Scaccia RED BANK NJ ,4.75,adult
4196,dr drmohammad hussein oakville on ca,4.75,dextroscoliosisstructuralcompensatory
4197,Dr SUZAN KHOROMI Washington DC ,4.5,dextroscoliosisfunctional
4199,Dr Philip Kritzinger Newmarket ON ,4.0,compensatory
4200,Dr Nirav Patel Ahmedabad GJ ,5.0,dextroscoliosis
4201,Dr RICARDO R. BALESTRA Philadelphia PA ,5.0,levoscoliosis
4202,Dr Maya B. Bledsoe Austin TX ,3.0,kyphosis
4203,Dr Poney Chiang Markham ON ,4.0,idiopathic
4204,Dr Karen L. Gallagher Indianapolis IN ,4.0,infantile
4205,Dr Elana M. Bern Boston MA ,1.5,juvenile
4206,Dr Michael W. Crane Mason City IA ,5.0,lordosis
4207,Dr Jeremy Richmon Baltimore MD ,4.0,adolescent
4208,Dr Julie Khanna Oakville ON ,4.75,adult
4209,dr jeff lo calgary ab ca,3.0,dextroscoliosisstructuralcompensatory
4210,Dr TERRY G. FIORI Palo Alto CA ,3.0,dextroscoliosisfunctional
4211,Dr Rohan Bissoondath Calgary AB ,4.0,dextroscoliosislevoscoliosisneuromuscular
4212,dr elfassy hannah laure montreal qc ca,4.75,compensatory
4213,Dr BIRGIT KNOECHEL Boston MA ,5.0,dextroscoliosis
4214,Dr Walid A. Saleh Dallas TX ,4.5,levoscoliosis
4215,Dr CHRISTA JILLARD Charleston SC ,5.0,kyphosis
4216,Dr Edoardo Cervoni Southport ENG ,4.5,idiopathic
4217,Dr Anil Rickhi Halifax NS ,5.0,infantile
4218,Dr Svetlana Kogan New York NY ,5.0,juvenile
4219,Dr Amy R. Mason Austin TX ,4.5,lordosis
4220,dr narayn pallai plano tx us,4.25,adolescent
4221,dr joumana salame calgary ab ca 2,4.75,adult
4224,Ryan Samuels Nelson BC ,5.0,dextroscoliosislevoscoliosisneuromuscular
4225,Dr Laurie Permack Toronto ON ,5.0,compensatory
4228,Dr STEPHEN J. MASSIMI STAMFORD CT ,4.75,kyphosis
4229,Dr Samer F. NAJJAR Arlington Hts IL ,5.0,idiopathic
4230,dr marty edwards philadelphia pa us,5.0,infantile
4231,dr mark silvert london eng uk,4.75,juvenile
4232,Dr Alexander Antonenko North York ON ,4.0,lordosis
4234,dr karin petersen ottawa on ca,4.75,adult
4235,Dr ANDREW J. OLINDE Baton Rouge LA ,1.0,dextroscoliosisstructuralcompensatory
4236,Dr Colleen Gnyp Calgary AB ,4.75,dextroscoliosisfunctional
4237,dr justin m fevold wenatchee wa us,5.0,dextroscoliosislevoscoliosisneuromuscular
4238,dr shannon joseph bel air md us,4.75,compensatory
4239,Dr Gail L. Wright HUDSON FL ,3.0,dextroscoliosis
4240,Dr Frederic Arsenault Levis QC ,5.0,levoscoliosis
4241,dr dr stephen morris sudbury on ca,4.5,kyphosis
4244,dr lottie r rotterman gresham or us,5.0,juvenile
4246,Dr F. Duane Turpin Bridgeton MO ,2.0,adolescent
4247,Dr NICOLE M. GODDARD RONCEVERTE WV ,5.0,adult
4249,Dr Christen Allaman Santa Cruz CA ,4.25,dextroscoliosisfunctional
4251,Dr Chloe Sylvestre Montreal QC ,4.0,compensatory
4252,Dr Pamela M. Klein GULF BREEZE FL ,4.0,dextroscoliosis
4253,Dr Murtaza N. Bhuriwala Houston TX ,4.75,levoscoliosis
4255,Dr Nouhad Saliba Montreal QC ,2.25,idiopathic
4257,Dr PADMAJA SAI Palm Coast FL ,4.0,juvenile
4258,Dr Sean Sinasac Amherstburg ON ,4.75,lordosis
4259,Dr Efrosini Fotopoulos Pompano Beach FL ,4.0,adolescent
4261,dr hoda motazedi toronto on ca,4.5,dextroscoliosisstructuralcompensatory
4262,Dr Katherine E. Johnson Fairbanks AK ,3.75,dextroscoliosisfunctional
4263,Dr Benjamin Gocial Philadelphia PA ,4.0,dextroscoliosislevoscoliosisneuromuscular
4264,Dr John L. Frattarelli Kailua HI ,5.0,compensatory
4266,Ryan Funk Vancouver BC ,5.0,levoscoliosis
4267,Dr Bethany A. Peterson Katy TX ,4.75,kyphosis
4269,Dr JOSEPH KRAJEKIAN Cleveland OH ,5.0,infantile
4270,Dr DANIELLE M. DUCHINI Erie PA ,5.0,juvenile
4271,dr daniel miller portland or us,4.75,lordosis
4272,Dr Paul J. Betschart New York NY ,4.25,adolescent
4274,Dr Kathryn Sowerwine Alexandria VA ,5.0,dextroscoliosisstructuralcompensatory
4275,Dr Caroline Tan Carlton VIC ,5.0,dextroscoliosisfunctional
4276,Dr Alexander Doctoroff Clark NJ ,3.5,dextroscoliosislevoscoliosisneuromuscular
4278,Dr JOHN SHALLAL SAVANNAH GA ,5.0,dextroscoliosis
4279,dr sibyl knight pacific grove ca us,5.0,levoscoliosis
4281,Dr Helene Nguyen Hackettstown NJ ,5.0,idiopathic
4282,Dr Catherine Lecours Quebec QC ,4.75,infantile
4283,Dr ASMAA CHAUDHRY CENTREVILLE VA ,4.0,juvenile
4284,Dr BECKIE M. GRGICH Colorado Springs CO ,4.75,lordosis
4286,Dr AZAM HAKIM LOUISVILLE KY ,5.0,adult
4287,dr khiraj chotee lloydminster ab ca,4.0,dextroscoliosisstructuralcompensatory
4288,Dr Amanda E. Matthews Albany GA ,5.0,dextroscoliosisfunctional
4290,Dr Ash Subramanian Eastbourne ENG ,4.0,compensatory
4291,Dr COSTAS A. APOSTOLIS AKRON OH ,4.0,dextroscoliosis
4293,Dr Barry SINGER St. Louis MO ,3.5,kyphosis
4294,dr geneva montano englewood co us,5.0,idiopathic
4295,Dr Gina Direnzo Coffey Boys Town NE ,4.0,infantile
4296,dr elizabeth segura saint bruno de montarville qc ca,5.0,juvenile
4297,Dr BALJEET S. UPPAL Binghamton NY ,5.0,lordosis
4298,Dr Herbert Veisman Toronto ON ,5.0,adolescent
4301,Dr Elizabeth Anderson Chicago IL ,3.0,dextroscoliosisfunctional
4302,Dr AMISH M. GANDHI Baltimore MD ,4.5,dextroscoliosislevoscoliosisneuromuscular
4303,Dr Axel Yabroudi Chandler AZ ,5.0,compensatory
4304,Dr MICHAEL S. SHAHBAZIAN Mission Viejo CA ,5.0,dextroscoliosis
4305,Dr ELENA FRID MANHASSET NY ,4.0,levoscoliosis
4306,Dr DOROTHY R. LORENZO New York NY ,5.0,kyphosis
4307,Dr OSCAR A. SCHWARTZ Creve Coeur MO ,3.0,idiopathic
4308,dr maia love vancouver bc ca,4.75,infantile
4310,Dr Belinda Sher Calgary AB ,5.0,lordosis
4311,Dr William H. Romero Dix Hills NY ,4.25,adolescent
4312,Dr IMAD V. EL JASSOUS Leesburg FL ,5.0,adult
4313,Dr David H. Feng Brick NJ ,5.0,dextroscoliosisstructuralcompensatory
4314,Dr Mohit Singla Brampton ON ,3.0,dextroscoliosisfunctional
4315,Dr Sarah M. Speck Seattle WA ,4.75,dextroscoliosislevoscoliosisneuromuscular
4316,Dr Richard Hareychuk Toronto ON ,4.5,compensatory
4317,Dr Marc Stickle West Kelowna BC ,5.0,dextroscoliosis
4318,Dr Arman Babajanyan Blue Mountains NSW ,4.5,levoscoliosis
4319,Dr George Tu Las Vegas NV ,4.0,kyphosis
4320,dr neel kumar tulsa ok us,4.5,idiopathic
4322,Dr HYEUN S. PARK MOUNTAIN LAKES NJ ,5.0,juvenile
4323,Dr NEEPA MAKIM Park Ridge IL ,5.0,lordosis
4325,dr mohit singla newmarket on ca,4.0,adult
4326,dr somayeh sadeghi trenton on ca,4.0,dextroscoliosisstructuralcompensatory
4328,dr subin vazhayil kozhikode kl in,5.0,dextroscoliosislevoscoliosisneuromuscular
4329,Dr Austin Chen Toronto ON ,4.5,compensatory
4330,Dr Michael E. Hoffman MIDDLETOWN NY ,4.0,dextroscoliosis
4332,Dr Jennifer Guillemaud Calgary AB ,5.0,kyphosis
4333,Dr Pei S. Lin Iselin NJ ,4.0,idiopathic
4336,Dr Nadia Persun Naperville IL ,5.0,lordosis
4337,Dr Dan Haas North York ON ,5.0,adolescent
4338,Dr MONIKA A. BARAKAT SCOTTSDALE AZ ,5.0,adult
4339,Dr Luciano Di Loreto Woodbridge ON ,5.0,dextroscoliosisstructuralcompensatory
4340,Dr Mangesh Inamdar Oakville ON ,4.75,dextroscoliosisfunctional
4341,Dr David L. Rashduni Scottsdale AZ ,4.25,dextroscoliosislevoscoliosisneuromuscular
4342,dr craig harris brisbane qld au,5.0,compensatory
4343,Dr Mark A. Saracino King Of Prussia PA ,5.0,dextroscoliosis
4344,Dr Jodi Sheppard Calgary AB ,5.0,levoscoliosis
4345,dr seyed assadi melbourne vic au,4.0,kyphosis
4346,CATHERINE DAYHOFF BELLINGHAM WA ,5.0,idiopathic
4349,Dr Amit Patel Barnegat NJ ,5.0,lordosis
4350,dr allen chu md phd fountain hill pa us,4.75,adolescent
4351,Dr RENJINI R. CHANDRA Leawood KS ,3.0,adult
4353,Dr Danial Deheshi Burnaby BC ,4.75,dextroscoliosisfunctional
4354,Dr James Bonaparte Ottawa ON ,4.0,dextroscoliosislevoscoliosisneuromuscular
4355,Dr Seema Bateson Columbia MD ,4.75,compensatory
4356,dr randhawa harkamal hamilton on ca,4.0,dextroscoliosis
4357,Dr Andreas Conradi Comox BC ,4.0,levoscoliosis
4360,Dr NAGASHREE GUNDU RAO Newton NJ ,5.0,infantile
4361,Dr Bruce S. Hoffman New York NY ,5.0,juvenile
4362,dr justin greiwe,5.0,lordosis
4363,Dr Stephen Baker Victoria BC ,4.0,adolescent
4364,Dr Douglas Steinbrech New York NY ,5.0,adult
4365,Dr PALLAVI R. CHERUKUPALLY McDonough GA ,1.25,dextroscoliosisstructuralcompensatory
4367,Dr Brian K. Machida West Covina CA ,5.0,dextroscoliosislevoscoliosisneuromuscular
4368,Edilia Pando Miramar FL ,4.25,compensatory
4369,Dr Bilal Kharbutli Dearborn MI ,5.0,dextroscoliosis
4370,Dr David McIntosh Maroochydore QLD ,4.0,levoscoliosis
4371,Dr SHANA N. WINGO PHOENIX AZ ,5.0,kyphosis
4372,Dr Paul Jang Langley BC ,4.5,idiopathic
4373,Dr Paul D. Abramson San Francisco CA ,4.0,infantile
4374,Scott Denny Fort Lauderdale FL ,5.0,juvenile
4376,Dr Kavita IYENGAR PANAMA CITY FL ,2.0,adolescent
4377,Dr Gregory Goodwin Boston MA ,5.0,adult
4378,Dr Douglas W. Roane Billings MT ,5.0,dextroscoliosisstructuralcompensatory
4380,Dr Michael L. Edmondson Tifton GA ,5.0,dextroscoliosislevoscoliosisneuromuscular
4381,dr patrina konnick iselin nj us,5.0,compensatory
4382,Dr Saeed Kohan Sydney NSW ,4.0,dextroscoliosis
4383,dr gokul subhas sioux city ia us,5.0,levoscoliosis
4384,Dr Joseph J. Schwartz Englewood NJ ,4.75,kyphosis
4385,dr nigel pereira new york ny us,5.0,idiopathic
4386,Dr Jean Patrick Turnblom Laval QC ,4.5,infantile
4387,Dr Eric S. Leichter GRAND FORKS ND ,3.25,juvenile
4388,DEENA B. HOLLINGSWORTH FALLS CHURCH VA ,5.0,lordosis
4389,Dr Daniel Isakow Toronto ON ,5.0,adolescent
4390,Dr Sudhir Rajkhowa Barrie ON ,4.0,adult
4391,Dr Michael T. Woronick Danbury CT ,4.75,dextroscoliosisstructuralcompensatory
4392,dr ray chung vancouver bc ca,5.0,dextroscoliosisfunctional
4393,Dr DIANA S. GLACCUM GAVAGNI MIAMI FL ,5.0,dextroscoliosislevoscoliosisneuromuscular
4394,Dr Bennett Mui Markham ON ,4.0,compensatory
4395,Dr VAUGHN BOWMAN Norwalk CT ,4.0,dextroscoliosis
4396,Dr Nadeem Aslam Etobicoke ON ,4.5,levoscoliosis
4398,Dr Heather Caruso Guelph ON ,5.0,idiopathic
4399,Dr Gregory H. Corsan Edison NJ ,4.0,infantile
4400,Dr Anna Aronzon New York NY ,3.75,juvenile
4402,Dr SARAH ULLMAN Ardmore PA ,4.0,adolescent
4403,Dr Amandeep K. Randhawa Vancouver BC ,5.0,adult
4404,Dr SUZANNE LEVINE New York NY ,3.0,dextroscoliosisstructuralcompensatory
4406,Dr Joshua M. Hurwitz NORWALK CT ,4.5,dextroscoliosislevoscoliosisneuromuscular
4407,Dr Kenneth Groves Niagara Falls ON ,5.0,compensatory
4408,Dr CHRISTOPHER P. MONTVILLE CINCINNATI OH ,4.75,dextroscoliosis
4409,Dr Anish S. Patel LIMERICK PA ,5.0,levoscoliosis
4410,Dr MIKE BROOKS Austin TX ,5.0,kyphosis
4411,Dr TAMARA S. PAULA CORAL GABLES FL ,5.0,idiopathic
4413,dr m ellen beatty temple terrace fl us,5.0,juvenile
4414,dr olivia marra chateauguay qc ca,4.0,lordosis
4415,Dr Marie Pupo Montreal QC ,4.75,adolescent
4416,Dr Mark Nalbandian North York ON ,5.0,adult
4417,Dr VINAY ANTIN Fort Worth TX ,5.0,dextroscoliosisstructuralcompensatory
4418,Dr Anne Frances Goodfellow Woodbridge ON ,3.0,dextroscoliosisfunctional
4419,dr kathy hahn new westminster bc ca,4.75,dextroscoliosislevoscoliosisneuromuscular
4420,Dr Jean Jaques (Jj) Dugoua Toronto ON ,4.5,compensatory
4421,Dr Mark Mandell Toronto ON ,4.0,dextroscoliosis
4422,Dr Amber Sheikh Niagara Falls ON ,3.25,levoscoliosis
4423,Dr Marnell P. Moore CRESSKILL NJ ,4.75,kyphosis
4426,Dr Roji Menon Kensington MD ,4.0,juvenile
4427,Dr Nilesh Salgar Montreal QC ,5.0,lordosis
4428,Dr Carol A. Wheeler Providence RI ,3.5,adolescent
4429,Dr Kristy Lewis Ottawa ON ,4.5,adult
4430,Dr Julio C. Guerra Randolph NJ ,4.25,dextroscoliosisstructuralcompensatory
4431,Dr Omar A. Ojjeh Naperville IL ,5.0,dextroscoliosisfunctional
4432,dr olga konwisorz calgary ab ca,4.75,dextroscoliosislevoscoliosisneuromuscular
4434,Dr COSTA G. SOTEROPOULOS Fairfax VA ,5.0,dextroscoliosis
4435,Dr Cameron Wong Calgary AB ,5.0,levoscoliosis
4436,Dr Gary F. Ciambotti hillsborough NJ ,5.0,kyphosis
4438,Dr Michelle Kane ST. LOUIS MO ,4.0,infantile
4439,Dr Christine M. Mullin Manhasset NY ,4.0,juvenile
4440,Dr DEREK T. PEEK NEW ORLEANS LA ,5.0,lordosis
4441,dr badr aldawood montreal qc ca,4.75,adolescent
4442,Dr Florence C. Barnett Johns Creek GA ,4.0,adult
4444,Dr LEE MCKINLEY Bloomington IN ,4.0,dextroscoliosisfunctional
4446,Dr WILLIAM E. WEBB Richmond Hill GA ,4.75,compensatory
4447,Dr RAHUL R. CHOPRA MELBOURNE FL ,5.0,dextroscoliosis
4448,Dr Helen Stosel Mission Viejo CA ,4.0,levoscoliosis
4449,Dr GABRIEL M. WERDER VIRGINIA BEACH VA ,4.75,kyphosis
4450,Dr Elena Dobbs Warner Robins GA ,4.5,idiopathic
4451,Dr LORETTA K. RUBENSTEIN Newport News VA ,5.0,infantile
4452,Dr CAROLYN LUCEY North Andover MA ,5.0,juvenile
4453,dr christina z atti palm beach gardens fl us,5.0,lordosis
4455,Dr AMY L. BRODE Livonia MI ,4.0,adult
4456,Dr Nicole M. Patel Tulsa OK ,4.0,dextroscoliosisstructuralcompensatory
4458,Dr Benoy V. Benny Houston TX ,4.0,dextroscoliosislevoscoliosisneuromuscular
4460,Dr Holman Yu Waterloo ON ,5.0,dextroscoliosis
4461,JING SHEN Chesterfield MO ,5.0,levoscoliosis
4462,dr piksi singh brisbane qld au,5.0,kyphosis
4463,Dr Kendra A. Cole DULUTH GA ,4.25,idiopathic
4464,Dr Tarun Jain Chicago IL ,5.0,infantile
4465,Dr Irina Korneeva Vladimirsky New York NY ,4.0,juvenile
4466,Dr Mohammad Bahasadri Toronto ON ,5.0,lordosis
4467,Dr Todd M. Kline Denver CO ,3.5,adolescent
4468,Dr Justin Vanderleest Mississauga ON ,4.0,adult
4469,dr dapo olayiwola calgary ab ca,4.75,dextroscoliosisstructuralcompensatory
4470,Dr Tanya T. Gold Tampa FL ,4.0,dextroscoliosisfunctional
4471,Dr Emma J. Patterson Portland OR ,3.75,dextroscoliosislevoscoliosisneuromuscular
4472,Dr Hy C. Sussman Augusta GA ,4.75,compensatory
4473,Dr Michelle Wittal Swift Current SK ,5.0,dextroscoliosis
4474,Dr Robert L. Harris Jackson MS ,5.0,levoscoliosis
4475,Dr SHAILEN G. WOODS Pittsburgh PA ,4.75,kyphosis
4476,Dr Tatyana Dubrovsky Hollywood FL ,1.5,idiopathic
4478,Dr CHARLES KEITH New York NY ,5.0,juvenile
4479,Dr Robert D. Graham FLORENCE OR ,5.0,lordosis
4480,Dr SHAHRIAR HEIDARY San Jose CA ,5.0,adolescent
4481,Dr Amy E. Burkhart Napa CA ,5.0,adult
4482,Dr Brooke Friedman San Diego CA ,5.0,dextroscoliosisstructuralcompensatory
4483,dr ali mcfadyen toronto on ca,5.0,dextroscoliosisfunctional
4484,Dr Kishan C. Agarwal EDISON NJ ,5.0,dextroscoliosislevoscoliosisneuromuscular
4487,Dr Nina Foot Vancouver BC ,5.0,levoscoliosis
4489,dr robert funk carmel in us,4.0,idiopathic
4490,Dr Firdos S. Sheikh Elk Grove CA ,2.0,infantile
4493,Dr Summit Shah Dublin OH ,5.0,adolescent
